{
  "ticket_id": "ASXFP_01_SCORECARDS",
  "state": "PLANNED",
  "allowed_scope_hash": "9273df987143b5f7dad3b60fcc3358c3ee8971369ec5b0993b847d309e353e1a",
  "implementation_attempts": 0,
  "retry_count": 0,
  "implementer_session_ids": [],
  "reviewer_session_id": null,
  "integrator_session_id": null,
  "blocker": null,
  "result_hashes": [],
  "output_hash": null,
  "child_result_hash": null,
  "review_result_hash": null
}
